{
  "schemaVersion": 1,
  "runId": "run-20260921-d2fe0d8-02",
  "sourceCommit": "d2fe0d8b430325315eecd2fa51feb9cccf94d9ec",
  "repositoryDirty": true,
  "startedAt": "2026-09-21T07:47:00.000Z",
  "completedAt": "2026-09-21T08:16:36.688Z",
  "environment": {
    "os": "win32",
    "release": "10.0.26200",
    "arch": "x64",
    "node": "v24.15.0",
    "npm": "11.12.1"
  },
  "definitionSources": [
    {
      "path": "acceptance/cases.json",
      "sha256": "cb215e1ff2da5f6c2a1495b6e14da2e9f0e1e4a7b179031dd08baffc6745eed5"
    },
    {
      "path": "acceptance/addenda/classroom-delivery.cases.json",
      "sha256": "f7238e8f927d0c6968d8d6bba1a8cadb1e7fd3f54c37a94fc0d07038c9c5fd06"
    }
  ],
  "supplementalEvidence": [
    {
      "path": "reports/acceptance-runs/g12-run-20260921-d2fe0d8-02.json",
      "sha256": "1acc108c36fccd0c5ddf78e882b5335be029d914f7dc74b240ae379475a241c4",
      "sizeBytes": 901
    }
  ],
  "results": [
    {
      "caseId": "BIZ-R001",
      "status": "NOT_RUN",
      "evidenceLevel": null,
      "command": null,
      "exitCode": null,
      "executedAt": null,
      "environment": "teacher_professional_review",
      "evidence": [],
      "artifactHashes": [],
      "blockerCode": null,
      "externalInputIds": [],
      "observedResult": "正式案例尚未执行；未从文档或宽泛测试结果推断通过。"
    },
    {
      "caseId": "BIZ-R002",
      "status": "NOT_RUN",
      "evidenceLevel": null,
      "command": null,
      "exitCode": null,
      "executedAt": null,
      "environment": "teacher_professional_review",
      "evidence": [],
      "artifactHashes": [],
      "blockerCode": null,
      "externalInputIds": [],
      "observedResult": "正式案例尚未执行；未从文档或宽泛测试结果推断通过。"
    },
    {
      "caseId": "BIZ-R003",
      "status": "NOT_RUN",
      "evidenceLevel": null,
      "command": null,
      "exitCode": null,
      "executedAt": null,
      "environment": "teacher_professional_review",
      "evidence": [],
      "artifactHashes": [],
      "blockerCode": null,
      "externalInputIds": [],
      "observedResult": "正式案例尚未执行；未从文档或宽泛测试结果推断通过。"
    },
    {
      "caseId": "BIZ-R004",
      "status": "NOT_RUN",
      "evidenceLevel": null,
      "command": null,
      "exitCode": null,
      "executedAt": null,
      "environment": "teacher_professional_review",
      "evidence": [],
      "artifactHashes": [],
      "blockerCode": null,
      "externalInputIds": [],
      "observedResult": "正式案例尚未执行；未从文档或宽泛测试结果推断通过。"
    },
    {
      "caseId": "BIZ-R005",
      "status": "NOT_RUN",
      "evidenceLevel": null,
      "command": null,
      "exitCode": null,
      "executedAt": null,
      "environment": "teacher_professional_review",
      "evidence": [],
      "artifactHashes": [],
      "blockerCode": null,
      "externalInputIds": [],
      "observedResult": "正式案例尚未执行；未从文档或宽泛测试结果推断通过。"
    },
    {
      "caseId": "BIZ-R006",
      "status": "NOT_RUN",
      "evidenceLevel": null,
      "command": null,
      "exitCode": null,
      "executedAt": null,
      "environment": "teacher_professional_review",
      "evidence": [],
      "artifactHashes": [],
      "blockerCode": null,
      "externalInputIds": [],
      "observedResult": "正式案例尚未执行；未从文档或宽泛测试结果推断通过。"
    },
    {
      "caseId": "BIZ-R007",
      "status": "NOT_RUN",
      "evidenceLevel": null,
      "command": null,
      "exitCode": null,
      "executedAt": null,
      "environment": "teacher_professional_review",
      "evidence": [],
      "artifactHashes": [],
      "blockerCode": null,
      "externalInputIds": [],
      "observedResult": "正式案例尚未执行；未从文档或宽泛测试结果推断通过。"
    },
    {
      "caseId": "BIZ-R008",
      "status": "NOT_RUN",
      "evidenceLevel": null,
      "command": null,
      "exitCode": null,
      "executedAt": null,
      "environment": "teacher_professional_review",
      "evidence": [],
      "artifactHashes": [],
      "blockerCode": null,
      "externalInputIds": [],
      "observedResult": "正式案例尚未执行；未从文档或宽泛测试结果推断通过。"
    },
    {
      "caseId": "BIZ-R009",
      "status": "NOT_RUN",
      "evidenceLevel": null,
      "command": null,
      "exitCode": null,
      "executedAt": null,
      "environment": "teacher_professional_review",
      "evidence": [],
      "artifactHashes": [],
      "blockerCode": null,
      "externalInputIds": [],
      "observedResult": "正式案例尚未执行；未从文档或宽泛测试结果推断通过。"
    },
    {
      "caseId": "BIZ-R010",
      "status": "NOT_RUN",
      "evidenceLevel": null,
      "command": null,
      "exitCode": null,
      "executedAt": null,
      "environment": "teacher_professional_review",
      "evidence": [],
      "artifactHashes": [],
      "blockerCode": null,
      "externalInputIds": [],
      "observedResult": "正式案例尚未执行；未从文档或宽泛测试结果推断通过。"
    },
    {
      "caseId": "BIZ-R011",
      "status": "NOT_RUN",
      "evidenceLevel": null,
      "command": null,
      "exitCode": null,
      "executedAt": null,
      "environment": "teacher_professional_review",
      "evidence": [],
      "artifactHashes": [],
      "blockerCode": null,
      "externalInputIds": [],
      "observedResult": "正式案例尚未执行；未从文档或宽泛测试结果推断通过。"
    },
    {
      "caseId": "BIZ-R012",
      "status": "NOT_RUN",
      "evidenceLevel": null,
      "command": null,
      "exitCode": null,
      "executedAt": null,
      "environment": "teacher_professional_review",
      "evidence": [],
      "artifactHashes": [],
      "blockerCode": null,
      "externalInputIds": [],
      "observedResult": "正式案例尚未执行；未从文档或宽泛测试结果推断通过。"
    },
    {
      "caseId": "BIZ-R013",
      "status": "NOT_RUN",
      "evidenceLevel": null,
      "command": null,
      "exitCode": null,
      "executedAt": null,
      "environment": "teacher_professional_review",
      "evidence": [],
      "artifactHashes": [],
      "blockerCode": null,
      "externalInputIds": [],
      "observedResult": "正式案例尚未执行；未从文档或宽泛测试结果推断通过。"
    },
    {
      "caseId": "BIZ-R014",
      "status": "NOT_RUN",
      "evidenceLevel": null,
      "command": null,
      "exitCode": null,
      "executedAt": null,
      "environment": "teacher_professional_review",
      "evidence": [],
      "artifactHashes": [],
      "blockerCode": null,
      "externalInputIds": [],
      "observedResult": "正式案例尚未执行；未从文档或宽泛测试结果推断通过。"
    },
    {
      "caseId": "BIZ-R015",
      "status": "NOT_RUN",
      "evidenceLevel": null,
      "command": null,
      "exitCode": null,
      "executedAt": null,
      "environment": "teacher_professional_review",
      "evidence": [],
      "artifactHashes": [],
      "blockerCode": null,
      "externalInputIds": [],
      "observedResult": "正式案例尚未执行；未从文档或宽泛测试结果推断通过。"
    },
    {
      "caseId": "BIZ-R016",
      "status": "NOT_RUN",
      "evidenceLevel": null,
      "command": null,
      "exitCode": null,
      "executedAt": null,
      "environment": "teacher_professional_review",
      "evidence": [],
      "artifactHashes": [],
      "blockerCode": null,
      "externalInputIds": [],
      "observedResult": "正式案例尚未执行；未从文档或宽泛测试结果推断通过。"
    },
    {
      "caseId": "BIZ-R017",
      "status": "NOT_RUN",
      "evidenceLevel": null,
      "command": null,
      "exitCode": null,
      "executedAt": null,
      "environment": "teacher_professional_review",
      "evidence": [],
      "artifactHashes": [],
      "blockerCode": null,
      "externalInputIds": [],
      "observedResult": "正式案例尚未执行；未从文档或宽泛测试结果推断通过。"
    },
    {
      "caseId": "BIZ-R018",
      "status": "NOT_RUN",
      "evidenceLevel": null,
      "command": null,
      "exitCode": null,
      "executedAt": null,
      "environment": "teacher_professional_review",
      "evidence": [],
      "artifactHashes": [],
      "blockerCode": null,
      "externalInputIds": [],
      "observedResult": "正式案例尚未执行；未从文档或宽泛测试结果推断通过。"
    },
    {
      "caseId": "BIZ-R019",
      "status": "NOT_RUN",
      "evidenceLevel": null,
      "command": null,
      "exitCode": null,
      "executedAt": null,
      "environment": "teacher_professional_review",
      "evidence": [],
      "artifactHashes": [],
      "blockerCode": null,
      "externalInputIds": [],
      "observedResult": "正式案例尚未执行；未从文档或宽泛测试结果推断通过。"
    },
    {
      "caseId": "BIZ-R020",
      "status": "NOT_RUN",
      "evidenceLevel": null,
      "command": null,
      "exitCode": null,
      "executedAt": null,
      "environment": "teacher_professional_review",
      "evidence": [],
      "artifactHashes": [],
      "blockerCode": null,
      "externalInputIds": [],
      "observedResult": "正式案例尚未执行；未从文档或宽泛测试结果推断通过。"
    },
    {
      "caseId": "BIZ-R021",
      "status": "NOT_RUN",
      "evidenceLevel": null,
      "command": null,
      "exitCode": null,
      "executedAt": null,
      "environment": "teacher_professional_review",
      "evidence": [],
      "artifactHashes": [],
      "blockerCode": null,
      "externalInputIds": [],
      "observedResult": "正式案例尚未执行；未从文档或宽泛测试结果推断通过。"
    },
    {
      "caseId": "BIZ-R022",
      "status": "NOT_RUN",
      "evidenceLevel": null,
      "command": null,
      "exitCode": null,
      "executedAt": null,
      "environment": "teacher_professional_review",
      "evidence": [],
      "artifactHashes": [],
      "blockerCode": null,
      "externalInputIds": [],
      "observedResult": "正式案例尚未执行；未从文档或宽泛测试结果推断通过。"
    },
    {
      "caseId": "BIZ-R023",
      "status": "NOT_RUN",
      "evidenceLevel": null,
      "command": null,
      "exitCode": null,
      "executedAt": null,
      "environment": "teacher_professional_review",
      "evidence": [],
      "artifactHashes": [],
      "blockerCode": null,
      "externalInputIds": [],
      "observedResult": "正式案例尚未执行；未从文档或宽泛测试结果推断通过。"
    },
    {
      "caseId": "BIZ-R024",
      "status": "NOT_RUN",
      "evidenceLevel": null,
      "command": null,
      "exitCode": null,
      "executedAt": null,
      "environment": "teacher_professional_review",
      "evidence": [],
      "artifactHashes": [],
      "blockerCode": null,